{"$defs":{"ActionId":{"maxLength":128,"pattern":"^action-[a-z0-9][a-z0-9-]*$","type":"string"},"AuthorityId":{"maxLength":128,"pattern":"^auth-[a-z0-9][a-z0-9-]*$","type":"string"},"CanonicalValue":{"anyOf":[{"type":"boolean"},{"type":"integer"},{"type":"string"},{"items":{"$ref":"#/$defs/CanonicalValue"},"type":"array"},{"additionalProperties":{"$ref":"#/$defs/CanonicalValue"},"type":"object"},{"type":"null"}]},"Digest":{"pattern":"^sha256:[0-9a-f]{64}$","type":"string"},"NonNegativeInt":{"minimum":0,"type":"integer"},"OperationName":{"maxLength":64,"pattern":"^[a-z][a-z0-9_]*$","type":"string"},"ParameterMap":{"additionalProperties":{"$ref":"#/$defs/CanonicalValue"},"propertyNames":{"$ref":"#/$defs/ParameterName"},"type":"object"},"ParameterName":{"maxLength":64,"pattern":"^[a-z][a-z0-9_]*$","type":"string"},"PositiveInt":{"exclusiveMinimum":0,"type":"integer"},"ServiceName":{"maxLength":64,"pattern":"^[a-z][a-z0-9_]*$","type":"string"},"SubjectId":{"maxLength":128,"pattern":"^[a-z0-9][a-z0-9-]*$","type":"string"}},"$schema":"https://json-schema.org/draft/2020-12/schema","additionalProperties":false,"description":"Immutable authorization for one semantic intent.","properties":{"allowed_compensation":{"anyOf":[{"$ref":"#/$defs/ActionId"},{"type":"null"}],"default":null},"allowed_parameters":{"$ref":"#/$defs/ParameterMap"},"authority_id":{"$ref":"#/$defs/AuthorityId"},"expires_at_tick":{"$ref":"#/$defs/NonNegativeInt"},"max_effects":{"$ref":"#/$defs/PositiveInt"},"operation":{"$ref":"#/$defs/OperationName"},"semantic_intent_digest":{"$ref":"#/$defs/Digest"},"service":{"$ref":"#/$defs/ServiceName"},"subject_id":{"$ref":"#/$defs/SubjectId"}},"required":["authority_id","subject_id","service","operation","semantic_intent_digest","allowed_parameters","expires_at_tick","max_effects"],"title":"AuthorityGrant","type":"object","x-side-effects-lab-schema-version":"0.1"}
