{
  "authority_id": "auth-create-issue",
  "subject_id": "reconcile-first",
  "service": "dummy_github",
  "operation": "create_issue",
  "semantic_intent_digest": "sha256:015abd7f5cc57a2dd94b7590f04ad8084273905ee33ec5cebeae62276a97f862",
  "allowed_parameters": {"title": "Update docs", "labels": ["docs"]},
  "expires_at_tick": 12,
  "max_effects": 1,
  "allowed_compensation": "action-close-issue"
}
